score,s1,s2
0.9368,"This course will provide an introduction to the field of Human-Computer Interaction and will introduce students to key interaction and experience design paradigms, approaches and methods.",This course provides a practical focus on the technology and research in the area of data mining.
0.9319,"The course will equip students with theory, methods, and techniques to investigate different design situations, develop novel design ideas, and ask critical questions about the role of technology in society.",This course provides a practical focus on the technology and research in the area of data mining.
0.9034,"Characterise key aspects of human-computer interaction, such as interaction design, the user experience, and user interfaces.",Critically analyse and justify the steps involved in the data mining process.
0.9234,"Differentiate between design paradigms, approaches, and methods and explain their applicability to different design contexts.",Test and apply the principal algorithms and techniques used in data mining.
0.9398,"Investigate the activities and practices of a design space using design research methods, to identify opportunities and issues for design intervention.",Appraise and reflect upon the results of a data mining project using suitable measurements.
0.9249,"Ideate, prototype, and evaluate novel technology design ideas and their use in context.",Anticipate and identify data issues related to data mining.
0.9233,"Critically reflect on the role of technology in society, including issues of power, agency, and representation in design.",Reflect upon ethical and social impacts of data mining.
