score,s1,s2
0.9067,"This course takes a detailed look at the services provided by, and the internals of, an existing operating system to see how each part is constructed and integrated into the whole.","In this course, you will learn fundamental concepts of data communication and networking in addition to gaining a working knowledge of network scalability, mobility, security, and managing capabilities."
0.8985,The lectures will also address recent literature describing advances in operating systems.,"Analyse the role of network standards, protocols, and layered models."
0.9090,"The following topics are addressed: system programming and its facilities (including I/O, signals, job control, interprocess communication, sockets, transport layers, remote operations), system calls and their relation to the system libraries, process management and coordination, implementation of message passing, memory management, interrupt handling, real-time clocks, device-independent input/output, serial-line drivers, network communication, disk drivers, deadlock avoidance, scheduling paradigms, file systems, security.","In this course, you will learn fundamental concepts of data communication and networking in addition to gaining a working knowledge of network scalability, mobility, security, and managing capabilities."
0.9363,"identify and evaluate features of the system library of a particular operating system, and be able to apply this knowledge to program small applications.",Create a virtual machine and apply tools for packet analysis and file encryption in a lab environment.
0.9170,describe and analyse the actual algorithms and data structures that are used in a particular operating system.,Create a virtual machine and apply tools for packet analysis and file encryption in a lab environment.
0.9292,"define and analyse the structure of operating systems in general, especially those that support communicating processes.","Analyse the role of network standards, protocols, and layered models."
0.9084,identify and describe the reasons for many architectural features of contemporary machines.,"Analyse the role of network standards, protocols, and layered models."
0.9127,demonstrate experience in the design and implementation of a large software system.,"In this course, you will learn fundamental concepts of data communication and networking in addition to gaining a working knowledge of network scalability, mobility, security, and managing capabilities."
