score,s1,s2
0.9071,"An introductory course in formal logic, dealing with propositional and predicate logic.","The course includes a deeper treatment of data structures, using hash tables, trees and lists, which are used to provide concrete implementations of abstract library collection types."
0.9054,Techniques of formal deduction and tests for the validity of arguments will be studied.,"The course includes a deeper treatment of data structures, using hash tables, trees and lists, which are used to provide concrete implementations of abstract library collection types."
0.9161,Basic semantic concepts will be discussed.,The important role of standard libraries and their collection types will be emphasized.  GUI programming will be introduced.
0.9282,Express reasoning problems using first order logical notation.,"Apply fundamental programming concepts, using an object oriented programming language, to solve substantial problems."
0.9261,Construct natural deduction proofs in first order logic and translate between calculi.,"The course includes a deeper treatment of data structures, using hash tables, trees and lists, which are used to provide concrete implementations of abstract library collection types."
0.9024,Explain the relationship between rules of deduction and the semantics of logic.,"The course includes a deeper treatment of data structures, using hash tables, trees and lists, which are used to provide concrete implementations of abstract library collection types."
0.9199,Critically assess and compare philosophical views on issues arising from elementary logic.,"Deliver and evaluate basic technical documents, presentations, and group interactions, using appropriate tools."
