score,s1,s2
0.9338,A practically oriented introduction to programming paradigms for parallel computers.,It expands particularly into all forms of concurrent programming including aspects of massively parallel programming.
0.9386,"Considers definitions of program efficiency on parallel computers, addresses the modelling, analysis and measurement of program performance.","Select appropriate modeling techniques, tools and mechanisms to solve a range of problems in concurrent and distributed systems."
0.9340,"Description, implementation and use of parallel programming languages, parallel features of operating systems, library routines and applications.","This course introduces all basic mechanisms to analyse, design, and manage concurrent, single computer-node (multicore) as well as distributed applications (e.g. as performance or dependability enhancements)."
0.9152,Be proficient at programming multiple parallel machines in more than one special programming language or programming system.,It expands particularly into all forms of concurrent programming including aspects of massively parallel programming.
0.9341,Be able to descriptively compare the performance of different programs and methods on one machine,"This course introduces all basic mechanisms to analyse, design, and manage concurrent, single computer-node (multicore) as well as distributed applications (e.g. as performance or dependability enhancements)."
0.9372,Demonstrate advanced knowledge of the elements of parallel programming language and system implementation.,Distinguish as well as connect conceptual concurrency with physical parallelism at all levels of a distributed system.
0.9304,Recall the history of parallel systems and describe the developments in the field.,These include the basics of routing and dependable protocols.
