score,s1,s2
0.9391,This course provides basic approaches for designing and analysing algorithms and data structures.,"Select appropriate modeling techniques, tools and mechanisms to solve a range of problems in concurrent and distributed systems."
0.9139,It will focus on two fundamental problems in computing: Sorting and searching.,These include the basics of routing and dependable protocols.
0.9435,"It will cover various data structures and algorithm design techniques for solving these two classes of problems, as well as basic performance measures and analysis techniques for solving such problems.","Select appropriate modeling techniques, tools and mechanisms to solve a range of problems in concurrent and distributed systems."
0.9365,"Display an advanced understanding of a variety of algorithms, including linear selection, minimum spanning trees, single source shortest path, Huffman coding, etc, with real-life applications and the resource requirements.","Select appropriate modeling techniques, tools and mechanisms to solve a range of problems in concurrent and distributed systems."
0.9343,"Expertly apply the most effective algorithmic techniques including dynamic programming, greedy policy, and divide-and-conquer, to solve some practical problems.","Select appropriate modeling techniques, tools and mechanisms to solve a range of problems in concurrent and distributed systems."
0.9378,Define and analyse time and space complexities of algorithms.,"Select appropriate modeling techniques, tools and mechanisms to solve a range of problems in concurrent and distributed systems."
0.9341,"Demonstrate experience in the design and implementation of algorithms for practical problems, using languages like C, C++.","Select appropriate modeling techniques, tools and mechanisms to solve a range of problems in concurrent and distributed systems."
