score,s1,s2
0.8834,Defensive Cyber Security operations introduces and exercises a complete range of anomaly / intrusion detection and identification mechanisms.,Prove simple programs correct using Hoare Logic.
0.8864,Students will also learn and exercise handling of an existing intrusion which includes forensic operations as well as securing the remaining systems.,Prove simple programs correct using Hoare Logic.
0.8887,This is a complete course in cyber defense which enables students on successful completion to operate systems under real-world exposure.,Design a Turing Machine which will accomplish simple tasks.
0.8900,Demonstrate a thorough understanding of the fundamental principles underlying the defence of systems and networks.,Design a Turing Machine which will accomplish simple tasks.
0.8807,Define and identify defensive cyber security architectures and their purpose.,Prove simple programs correct using Hoare Logic.
0.8888,Operate defensive network architectures and systems in a practical context.,Prove simple programs correct using Hoare Logic.
0.8487,"Extrapolate current threats and identify potential, future threats.",Design a Turing Machine which will accomplish simple tasks.
0.8723,Communicate a cyber security situation and response to a heterogenous team of professionals.,Design a Turing Machine which will accomplish simple tasks.
