score,s1,s2
0.9415,Defensive Cyber Security operations introduces and exercises a complete range of anomaly / intrusion detection and identification mechanisms.,Migrate insights from cyber security analysis into new designs.
0.9440,Students will also learn and exercise handling of an existing intrusion which includes forensic operations as well as securing the remaining systems.,"The course provides the essential foundations which allow students to continue in a more in-depth cyber security career, yet can also be used a standalone unit to provide a self-contained set of knowledge."
0.9562,This is a complete course in cyber defense which enables students on successful completion to operate systems under real-world exposure.,"The course provides the essential foundations which allow students to continue in a more in-depth cyber security career, yet can also be used a standalone unit to provide a self-contained set of knowledge."
0.9630,Demonstrate a thorough understanding of the fundamental principles underlying the defence of systems and networks.,Demonstrate a thorough understanding of the fundamental principles underlying Cyber Security.
0.9639,Define and identify defensive cyber security architectures and their purpose.,Define and identify cyber security principles and their violation.
0.9447,Operate defensive network architectures and systems in a practical context.,Apply cyber security principles in a practical context.
0.9068,"Extrapolate current threats and identify potential, future threats.",The interplay between failed security principles and vulnerabilities is investigated in detail.
0.9746,Communicate a cyber security situation and response to a heterogenous team of professionals.,Communicate a cyber security thread to a heterogenous team of professionals.
