score,s1,s2
0.9011,"This course takes a detailed look at the services provided by, and the internals of, an existing operating system to see how each part is constructed and integrated into the whole.",The course will be taught using one or more programming languages which are widely applicable to scientific work.
0.9204,The lectures will also address recent literature describing advances in operating systems.,There will be an introduction to widely-used computer science algorithms and to machine architecture.
0.8975,"The following topics are addressed: system programming and its facilities (including I/O, signals, job control, interprocess communication, sockets, transport layers, remote operations), system calls and their relation to the system libraries, process management and coordination, implementation of message passing, memory management, interrupt handling, real-time clocks, device-independent input/output, serial-line drivers, network communication, disk drivers, deadlock avoidance, scheduling paradigms, file systems, security.",Have an understanding of practical aspects of machine architecture including finite precision and rounding errors.
0.9384,"identify and evaluate features of the system library of a particular operating system, and be able to apply this knowledge to program small applications.","Design, write and debug small programs to solve practical problems of a scientific nature."
0.9303,describe and analyse the actual algorithms and data structures that are used in a particular operating system.,Be able to describe and design small computer programs using both procedural and object-oriented methodologies.
0.9327,"define and analyse the structure of operating systems in general, especially those that support communicating processes.",Be able to describe and design small computer programs using both procedural and object-oriented methodologies.
0.9136,identify and describe the reasons for many architectural features of contemporary machines.,Have an understanding of some widely-used algorithms.
0.9314,demonstrate experience in the design and implementation of a large software system.,Have a practical understanding of the processing of scientific data.
