score,s1,s2
0.9109,"This course covers a range of concepts, techniques and technologies in network security.",This course provides an introduction to High Performance Computing with an orientation towards applications in science and engineering.
0.9105,"This includes an overview of relevant network protocols and cryptography; analyses of designs and implementations of security protocols, including basic tools and techniques; an understanding of network threats and attacks such as eavesdropping, spoofing, protocol failures, DoS attacks and man-in-the-middle attacks; network defence including threat analysis and identification, architecture control, intrusion detection and layered security.","The following topics will be addressed: the C++ programming language; basic numerical computing from aspects of floating point error analysis to algorithms for solving differential equations; the engineering of scientific software; general high performance computing concepts and architectural principles; modern scalar architectures and their memory structure; performance and programmability issues, and program analysis techniques for high performance computing; parallel computing paradigms and programming using the OpenMP standard; trends in HPC systems."
0.9286,"The course features hands-on lectures and labs to analyse network vulnerabilities, and design and implement appropriate defensive techniques.",It will also look at practical methods of estimating and measuring algorithm/architecture performance.
0.9012,Explain network security issues.,appreciate the building blocks of scientific and engineering software.
0.8992,"Understand various threats and vulnerabilities of a network, and explain appropriate countermeasures.",have an understanding of the various paradigms of high performance computing and their potential for performance and programmability.
0.9195,Perform simple penetration testing of a network and network services,be competent in experimental computing in a numerical context and of the optimisation of algorithms on high performance architectures.
0.9198,Perform a threat analysis / vulnerability assessment of protocol designs and implementations.,It will also look at practical methods of estimating and measuring algorithm/architecture performance.
0.8749,Design and implement appropriate defensive countermeasures against identified threats and vulnerabilities.,have an understanding of the various paradigms of high performance computing and their potential for performance and programmability.
