score,s1,s2
0.9328,"This course studies the standard models for the layered approach to communication between autonomous machines in a network, and the main characteristics of data transmission across various physical link types.",Describe and apply alternative computational paradigms to simple problems.
0.9467,"It considers how to design networks and protocols for diverse situations, analyses several application and support protocols from a distributed systems viewpoint, and identifies significant problem areas in networked communications.",Describe and apply alternative computational paradigms to simple problems.
0.9135,"Topics include: communication network architectures, signalling and modulation across physical media, real-world local and wide-area networks, internet protocol fundamentals, performance and monitoring of networks, routing, network security, and application protocols for distributed systems including web, email, video, internet-of-everything and other contemporary network topics.","Students also gain exposure to structural induction and proof, introduction to asymptotic analysis of basic data structures, abstract data types, modules, laziness, and streams."
0.9263,Understand and describe the layered protocol model.,Describe and apply alternative computational paradigms to simple problems.
0.9117,"Describe, analyse and compare a number of datalink, network, and transport layer protocols.","Describe, understand and evolve programs, via documentation, testing, and debugging."
0.9124,Program network communication services for client/server and other application layouts.,These include distributed software revision control systems.
0.9355,"Describe and analyse various related technical, administrative and social aspects of specific computer network protocols from standards documents and other primary materials found through research.",Describe and apply alternative computational paradigms to simple problems.
0.8776,"Design and/or analyse networks and services for homes, data centres, IoT/IoE, LANs and WANs.","Students also gain exposure to structural induction and proof, introduction to asymptotic analysis of basic data structures, abstract data types, modules, laziness, and streams."
