score,s1,s2
0.8790,"This course covers a range of concepts, techniques and technologies in network security.","This course presents some formal notations that are commonly used for the description of computation and of computing systems, for the specification of software and for mathematically rigorous arguments about program properties."
0.8740,"This includes an overview of relevant network protocols and cryptography; analyses of designs and implementations of security protocols, including basic tools and techniques; an understanding of network threats and attacks such as eavesdropping, spoofing, protocol failures, DoS attacks and man-in-the-middle attacks; network defence including threat analysis and identification, architecture control, intrusion detection and layered security.","This course presents some formal notations that are commonly used for the description of computation and of computing systems, for the specification of software and for mathematically rigorous arguments about program properties."
0.8812,"The course features hands-on lectures and labs to analyse network vulnerabilities, and design and implement appropriate defensive techniques.",Design a Turing Machine which will accomplish simple tasks.
0.8771,Explain network security issues.,Design a Turing Machine which will accomplish simple tasks.
0.8617,"Understand various threats and vulnerabilities of a network, and explain appropriate countermeasures.",Design a Turing Machine which will accomplish simple tasks.
0.8982,Perform simple penetration testing of a network and network services,Design a Turing Machine which will accomplish simple tasks.
0.8912,Perform a threat analysis / vulnerability assessment of protocol designs and implementations.,Design a Turing Machine which will accomplish simple tasks.
0.8482,Design and implement appropriate defensive countermeasures against identified threats and vulnerabilities.,Design a Turing Machine which will accomplish simple tasks.
