score,s1,s2
0.9082,"This course studies the standard models for the layered approach to communication between autonomous machines in a network, and the main characteristics of data transmission across various physical link types.",The interplay between failed security principles and vulnerabilities is investigated in detail.
0.9264,"It considers how to design networks and protocols for diverse situations, analyses several application and support protocols from a distributed systems viewpoint, and identifies significant problem areas in networked communications.",The interplay between failed security principles and vulnerabilities is investigated in detail.
0.9119,"Topics include: communication network architectures, signalling and modulation across physical media, real-world local and wide-area networks, internet protocol fundamentals, performance and monitoring of networks, routing, network security, and application protocols for distributed systems including web, email, video, internet-of-everything and other contemporary network topics.","This includes principles of secure design, secrets minimization, least privilege, isolation, separation and encapsulation."
0.9236,Understand and describe the layered protocol model.,Define and identify cyber security principles and their violation.
0.9057,"Describe, analyse and compare a number of datalink, network, and transport layer protocols.","This includes principles of secure design, secrets minimization, least privilege, isolation, separation and encapsulation."
0.9034,Program network communication services for client/server and other application layouts.,Communicate a cyber security thread to a heterogenous team of professionals.
0.9321,"Describe and analyse various related technical, administrative and social aspects of specific computer network protocols from standards documents and other primary materials found through research.",Define and identify cyber security principles and their violation.
0.8763,"Design and/or analyse networks and services for homes, data centres, IoT/IoE, LANs and WANs.","This includes principles of secure design, secrets minimization, least privilege, isolation, separation and encapsulation."
