score,s1,s2
0.8888,Computer graphics are an essential part of modern software.,Artificial intelligence is the science that studies and develops methods of making computers more /intelligent/.
0.9453,"In this course students will learn about fundamental algorithms, data structures and programming models used in 3D graphics applications.","The focus of this course is on core AI techniques for search, knowledge representation and reasoning, planning, and designing intelligent agents."
0.9287,"These key concepts in computer graphics programming will be covered from their mathematical foundations through to their application in domains such as data visualisation, virtual reality, computer games and film animation/VFX.","The focus of this course is on core AI techniques for search, knowledge representation and reasoning, planning, and designing intelligent agents."
0.9359,In this course students will explore these concepts through practical implementation in a modern computer graphics software context.,"The focus of this course is on core AI techniques for search, knowledge representation and reasoning, planning, and designing intelligent agents."
0.9015,"Explain the stages of a modern, hardware-accelerated 3D rendering pipeline","The focus of this course is on core AI techniques for search, knowledge representation and reasoning, planning, and designing intelligent agents."
0.9124,"Construct and manipulate complex models, geometries and scene graphs in both 2D and 3D","The focus of this course is on core AI techniques for search, knowledge representation and reasoning, planning, and designing intelligent agents."
0.9070,Implement computer graphics algorithms in a shader language,"Implement basic AI algorithms (e.g., standard search or constraint propagation algorithms)."
