score,s1,s2
0.8969,Information theory studies the fundamental limits of the representation and transmission of information.,"Demonstrate basic knowledge and understanding of descriptive and predictive data analysis methods, optimization and search, and knowledge representation."
0.9326,"This course provides an introduction to information theory, studying fundamental concepts such as probability, information, and entropy and examining their applications in the areas of data compression, coding, communications, pattern recognition and probabilistic inference.","Tour the basic techniques of data science, including both SQL and NoSQL solutions for massive data management, basic statistical modeling (e.g., descriptive statistics, linear and non-linear regression), algorithms for machine learning and optimization, and fundamentals of knowledge representation and search."
0.9395,"Understand and apply fundamental concepts in information theory such as probability, entropy, information content and their inter-relationships.","Demonstrate basic knowledge and understanding of descriptive and predictive data analysis methods, optimization and search, and knowledge representation."
0.9099,Understand the principles of data compression.,Learn key concepts in security and the use of cryptographic techniques in securing data.
0.8866,Compute entropy and mutual information of random variables.,Formulate and extract descriptive and predictive statistics from data.
0.9200,Implement and analyse basic coding and compression algorithms.,"Demonstrate basic knowledge and understanding of descriptive and predictive data analysis methods, optimization and search, and knowledge representation."
0.9479,Understand the relationship of information theoretical principles and Bayesian inference in data modelling and pattern recognition.,"Demonstrate basic knowledge and understanding of descriptive and predictive data analysis methods, optimization and search, and knowledge representation."
0.9238,"Understand some key theorems and inequalities that quantify essential limitations on compression, communication and inference.","Demonstrate basic knowledge and understanding of descriptive and predictive data analysis methods, optimization and search, and knowledge representation."
0.9062,Know the basic concepts regarding communications over noisy channels.,Apply their knowledge to a given problem domain and articulate potential data analysis problems.
