score,s1,s2
0.9228,Computer graphics are an essential part of modern software.,"Because software is a critical component of such systems, Software Engineers will often work in Systems Engineering teams."
0.9120,"In this course students will learn about fundamental algorithms, data structures and programming models used in 3D graphics applications.","Because software is a critical component of such systems, Software Engineers will often work in Systems Engineering teams."
0.9112,"These key concepts in computer graphics programming will be covered from their mathematical foundations through to their application in domains such as data visualisation, virtual reality, computer games and film animation/VFX.","Systems Engineering is a holistic, multi-disciplinary and well established approach to the engineering of these complex systems."
0.9241,In this course students will explore these concepts through practical implementation in a modern computer graphics software context.,Design for sustainability: approaches that integrate sustainability principles into the design process.
0.8987,"Explain the stages of a modern, hardware-accelerated 3D rendering pipeline",describe the holistic and multi-disciplinary nature of complex engineering projects.
0.9076,"Construct and manipulate complex models, geometries and scene graphs in both 2D and 3D","Conceptual system design: including problem definition, technical performance measures, quality function deployment (QFD), trade-off analyses, and system specification."
0.8817,Implement computer graphics algorithms in a shader language,"Because software is a critical component of such systems, Software Engineers will often work in Systems Engineering teams."
