score,s1,s2
0.9381,Offensive Cyber Security operations introduces and exercises a complete range of reverse engineering techniques and attack patterns. Students will also learn and exercise analysis of systems based on minimal information.,"It considers how to design networks and protocols for diverse situations, analyses several application and support protocols from a distributed systems viewpoint, and identifies significant problem areas in networked communications."
0.9275,This is a complete course in cyber attacks which enables students on successful completion to identify and test systems for vulnerabilities without full knowledge or direct access.,"Describe and analyse various related technical, administrative and social aspects of specific computer network protocols from standards documents and other primary materials found through research."
0.9211,Demonstrate a thorough understanding of the fundamental principles underlying the identification and testing for vulnerabilities with limited information.,"Describe and analyse various related technical, administrative and social aspects of specific computer network protocols from standards documents and other primary materials found through research."
0.9430,"Analyze a system across all abstraction levels, from basic hardware to complex cloud architectures.","It considers how to design networks and protocols for diverse situations, analyses several application and support protocols from a distributed systems viewpoint, and identifies significant problem areas in networked communications."
0.9264,"Run cyber attacks, tests and probes in a practical context.","Describe and analyse various related technical, administrative and social aspects of specific computer network protocols from standards documents and other primary materials found through research."
0.9505,Expand conventional attack patterns to work in new system and network architectures.,"It considers how to design networks and protocols for diverse situations, analyses several application and support protocols from a distributed systems viewpoint, and identifies significant problem areas in networked communications."
0.9179,Communicate a cyber security vulnerability and potential paths of attack to a heterogenous team of professionals.,"It considers how to design networks and protocols for diverse situations, analyses several application and support protocols from a distributed systems viewpoint, and identifies significant problem areas in networked communications."
