score,s1,s2
0.9263,"Software Security covers advanced techniques in software vulnerability assessment, discovery and mitigation.",Perform a threat analysis / vulnerability assessment of protocol designs and implementations.
0.9232,"These include: common patterns in software vulnerabilities, such as stack-based buffer overflow, format string vulnerabilities, and heap-based vulnerabilities; exploitation techniques such as code injection, return-oriented-programming; techniques for vulnerability discovery, such as program binaries reverse engineering, fuzzing and symbolic execution; and mitigation techniques such as memory protection mechanisms, input sanitation, and control flow integrity protection.","This includes an overview of relevant network protocols and cryptography; analyses of designs and implementations of security protocols, including basic tools and techniques; an understanding of network threats and attacks such as eavesdropping, spoofing, protocol failures, DoS attacks and man-in-the-middle attacks; network defence including threat analysis and identification, architecture control, intrusion detection and layered security."
0.9714,"The course features hands-on lectures and labs to analyse software vulnerabilities, both in the source code and in program binaries, and design and implement appropriate mitigation techniques.","The course features hands-on lectures and labs to analyse network vulnerabilities, and design and implement appropriate defensive techniques."
0.9391,Demonstrate a thorough understanding of common sources of vulnerabilities in software.,"Understand various threats and vulnerabilities of a network, and explain appropriate countermeasures."
0.9439,Demonstrate a thorough understanding in exploitation techniques against software vulnerabilities and defensive techniques against these exploitations.,"Understand various threats and vulnerabilities of a network, and explain appropriate countermeasures."
0.9150,Demonstrate proficiency in software reverse engineering.,Perform simple penetration testing of a network and network services
0.9302,"Demonstrate proficiency in vulnerability discovery processes, from both source code and binary.",Perform a threat analysis / vulnerability assessment of protocol designs and implementations.
0.9546,"Apply the vulnerability discovery techniques to real-world software, analyse their vulnerabilities and design and implement appropriate mitigation techniques.","The course features hands-on lectures and labs to analyse network vulnerabilities, and design and implement appropriate defensive techniques."
