score,s1,s2
1.0000,This course provides basic approaches for designing and analysing algorithms and data structures.,This course provides basic approaches for designing and analysing algorithms and data structures.
1.0000,It will focus on two fundamental problems in computing: Sorting and searching.,It will focus on two fundamental problems in computing: Sorting and searching.
1.0000,"It will cover various data structures and algorithm design techniques for solving these two classes of problems, as well as basic performance measures and analysis techniques for solving such problems.","It will cover various data structures and algorithm design techniques for solving these two classes of problems, as well as basic performance measures and analysis techniques for solving such problems."
1.0000,"Display an advanced understanding of a variety of algorithms, including linear selection, minimum spanning trees, single source shortest path, Huffman coding, etc, with real-life applications and the resource requirements.","Display an advanced understanding of a variety of algorithms, including linear selection, minimum spanning trees, single source shortest path, Huffman coding, etc, with real-life applications and the resource requirements."
1.0000,"Expertly apply the most effective algorithmic techniques including dynamic programming, greedy policy, and divide-and-conquer, to solve some practical problems.","Expertly apply the most effective algorithmic techniques including dynamic programming, greedy policy, and divide-and-conquer, to solve some practical problems."
1.0000,Define and analyse time and space complexities of algorithms.,Define and analyse time and space complexities of algorithms.
1.0000,"Demonstrate experience in the design and implementation of algorithms for practical problems, using languages like C, C++.","Demonstrate experience in the design and implementation of algorithms for practical problems, using languages like C, C++."
