score,s1,s2
0.9421,"This course studies the standard models for the layered approach to communication between autonomous machines in a network, and the main characteristics of data transmission across various physical link types.","Considers definitions of program efficiency on parallel computers, addresses the modelling, analysis and measurement of program performance."
0.9456,"It considers how to design networks and protocols for diverse situations, analyses several application and support protocols from a distributed systems viewpoint, and identifies significant problem areas in networked communications.","Considers definitions of program efficiency on parallel computers, addresses the modelling, analysis and measurement of program performance."
0.9328,"Topics include: communication network architectures, signalling and modulation across physical media, real-world local and wide-area networks, internet protocol fundamentals, performance and monitoring of networks, routing, network security, and application protocols for distributed systems including web, email, video, internet-of-everything and other contemporary network topics.","Description, implementation and use of parallel programming languages, parallel features of operating systems, library routines and applications."
0.9236,Understand and describe the layered protocol model.,Demonstrate advanced knowledge of the elements of parallel programming language and system implementation.
0.9210,"Describe, analyse and compare a number of datalink, network, and transport layer protocols.","Considers definitions of program efficiency on parallel computers, addresses the modelling, analysis and measurement of program performance."
0.9163,Program network communication services for client/server and other application layouts.,"Description, implementation and use of parallel programming languages, parallel features of operating systems, library routines and applications."
0.9306,"Describe and analyse various related technical, administrative and social aspects of specific computer network protocols from standards documents and other primary materials found through research.","Considers definitions of program efficiency on parallel computers, addresses the modelling, analysis and measurement of program performance."
0.8898,"Design and/or analyse networks and services for homes, data centres, IoT/IoE, LANs and WANs.","Description, implementation and use of parallel programming languages, parallel features of operating systems, library routines and applications."
