score,s1,s2
0.8849,"Software Security covers advanced techniques in software vulnerability assessment, discovery and mitigation.",Understanding of the process of identifying and formulating research problems.
0.8902,"These include: common patterns in software vulnerabilities, such as stack-based buffer overflow, format string vulnerabilities, and heap-based vulnerabilities; exploitation techniques such as code injection, return-oriented-programming; techniques for vulnerability discovery, such as program binaries reverse engineering, fuzzing and symbolic execution; and mitigation techniques such as memory protection mechanisms, input sanitation, and control flow integrity protection.","This includes different tasks such as topic modelling, statistical analysis, applying different machine learning techniques to solve a problem in a team, proving theorems, complexity analysis, designing a research project, reviewing papers and presenting papers."
0.9163,"The course features hands-on lectures and labs to analyse software vulnerabilities, both in the source code and in program binaries, and design and implement appropriate mitigation techniques.","This includes different tasks such as topic modelling, statistical analysis, applying different machine learning techniques to solve a problem in a team, proving theorems, complexity analysis, designing a research project, reviewing papers and presenting papers."
0.8917,Demonstrate a thorough understanding of common sources of vulnerabilities in software.,Understanding of the process of identifying and formulating research problems.
0.9152,Demonstrate a thorough understanding in exploitation techniques against software vulnerabilities and defensive techniques against these exploitations.,Demonstrate an awareness of the existence of technological choices; and make appropriate choices based on a consideration of design criteria.
0.9147,Demonstrate proficiency in software reverse engineering.,This includes demonstrated skills in the writing of abstracts and research papers.
0.9112,"Demonstrate proficiency in vulnerability discovery processes, from both source code and binary.",This includes demonstrated skills in the writing of abstracts and research papers.
0.9177,"Apply the vulnerability discovery techniques to real-world software, analyse their vulnerabilities and design and implement appropriate mitigation techniques.","This includes different tasks such as topic modelling, statistical analysis, applying different machine learning techniques to solve a problem in a team, proving theorems, complexity analysis, designing a research project, reviewing papers and presenting papers."
