score,s1,s2
0.8743,Cyber Security Foundations introduces all essential cyber security principles.,"This is an advanced undergraduate course that covers advanced topics in Artificial Intelligence. Topics vary from one offering to the next and are likely to be drawn from the following list: planning, scheduling, games, search, reasoning (constraint-based, model-based, spatial, temporal), knowledge representation, decision-making under uncertainty, reinforcement learning, agents, foundations."
0.9044,"This includes principles of secure design, secrets minimization, least privilege, isolation, separation and encapsulation.","This is an advanced undergraduate course that covers advanced topics in Artificial Intelligence. Topics vary from one offering to the next and are likely to be drawn from the following list: planning, scheduling, games, search, reasoning (constraint-based, model-based, spatial, temporal), knowledge representation, decision-making under uncertainty, reinforcement learning, agents, foundations."
0.8924,The interplay between failed security principles and vulnerabilities is investigated in detail.,"Improve their skills at navigating through, and critically examining, the scientific literature on the taught topic(s)."
0.9253,"The course provides the essential foundations which allow students to continue in a more in-depth cyber security career, yet can also be used a standalone unit to provide a self-contained set of knowledge.",Gain both a wide and a deep knowledge of the topic(s) taught in the current instance of the course.
0.9044,Demonstrate a thorough understanding of the fundamental principles underlying Cyber Security.,"Improve their skills at navigating through, and critically examining, the scientific literature on the taught topic(s)."
0.8788,Define and identify cyber security principles and their violation.,"This is an advanced undergraduate course that covers advanced topics in Artificial Intelligence. Topics vary from one offering to the next and are likely to be drawn from the following list: planning, scheduling, games, search, reasoning (constraint-based, model-based, spatial, temporal), knowledge representation, decision-making under uncertainty, reinforcement learning, agents, foundations."
0.8854,Apply cyber security principles in a practical context.,"Improve their skills at navigating through, and critically examining, the scientific literature on the taught topic(s)."
0.8851,Migrate insights from cyber security analysis into new designs.,"This is an advanced undergraduate course that covers advanced topics in Artificial Intelligence. Topics vary from one offering to the next and are likely to be drawn from the following list: planning, scheduling, games, search, reasoning (constraint-based, model-based, spatial, temporal), knowledge representation, decision-making under uncertainty, reinforcement learning, agents, foundations."
0.8821,Communicate a cyber security thread to a heterogenous team of professionals.,"Improve their skills at navigating through, and critically examining, the scientific literature on the taught topic(s)."
