score,s1,s2
0.9191,This course provides a broad but thorough introduction to the methods and practice of statistical machine learning.,"This course provides foundations and plenty of exercises in practical optimisation problems, while covering all basic elements of optimisation including forms of constraint programming as well as variations on linear programming and convex optimisation."
0.9114,"Topics covered will include Bayesian inference and maximum likelihood modeling; regression, classification, density estimation, clustering, principal and independent component analysis; parametric, semi-parametric, and non-parametric models; basis functions, neural networks, kernel methods, and graphical models; deterministic and stochastic optimisation; overfitting, regularisation, and validation.","This course provides foundations and plenty of exercises in practical optimisation problems, while covering all basic elements of optimisation including forms of constraint programming as well as variations on linear programming and convex optimisation."
0.8900,"Describe a number of models for supervised, unsupervised, and reinforcement machine learning.","This course provides foundations and plenty of exercises in practical optimisation problems, while covering all basic elements of optimisation including forms of constraint programming as well as variations on linear programming and convex optimisation."
0.8967,Assess the strength and weakness of each of these models.,Demonstrate an understanding of theoretical foundations of convex optimization and be able to use it to characterize optimal solutions to general problems.
0.9371,"Interpret the mathematical equations from Linear Algebra, Statistics, and Probability Theory used in these machine learning models.",Be able to apply Linear Programming and Mixed-Integer Programming model to solve real-world problems.
0.9102,Implement efficient machine learning algorithms on a computer.,Be able to apply Linear Programming and Mixed-Integer Programming model to solve real-world problems.
0.9134,Design test procedures in order to evaluate a model.,Demonstrate an understanding of theoretical foundations of convex optimization and be able to use it to characterize optimal solutions to general problems.
0.9194,Combine several models in order to gain better results.,Demonstrate an understanding of theoretical foundations of convex optimization and be able to use it to characterize optimal solutions to general problems.
0.9234,Make choices for a model for new machine learning tasks based on reasoned argument.,Be able to use a variety of meta-heuristics to escape local minima in a neighbourhood.
