score,s1,s2
0.9208,"This course will provide an introduction to the field of Human-Computer Interaction and will introduce students to key interaction and experience design paradigms, approaches and methods.","The course features hands-on lectures and labs to analyse network vulnerabilities, and design and implement appropriate defensive techniques."
0.9397,"The course will equip students with theory, methods, and techniques to investigate different design situations, develop novel design ideas, and ask critical questions about the role of technology in society.","The course features hands-on lectures and labs to analyse network vulnerabilities, and design and implement appropriate defensive techniques."
0.8983,"Characterise key aspects of human-computer interaction, such as interaction design, the user experience, and user interfaces.","The course features hands-on lectures and labs to analyse network vulnerabilities, and design and implement appropriate defensive techniques."
0.9075,"Differentiate between design paradigms, approaches, and methods and explain their applicability to different design contexts.","The course features hands-on lectures and labs to analyse network vulnerabilities, and design and implement appropriate defensive techniques."
0.9246,"Investigate the activities and practices of a design space using design research methods, to identify opportunities and issues for design intervention.","The course features hands-on lectures and labs to analyse network vulnerabilities, and design and implement appropriate defensive techniques."
0.9119,"Ideate, prototype, and evaluate novel technology design ideas and their use in context.","The course features hands-on lectures and labs to analyse network vulnerabilities, and design and implement appropriate defensive techniques."
0.8815,"Critically reflect on the role of technology in society, including issues of power, agency, and representation in design.","The course features hands-on lectures and labs to analyse network vulnerabilities, and design and implement appropriate defensive techniques."
