score,s1,s2
0.8984,"This course covers a range of concepts, techniques and technologies in network security.","This course introduces core concepts of data cleaning, standardisation, and data integration, that are aimed at converting and mapping raw data into other formats that allow more efficient and convenient use and analysis of data. The courses also discusses data quality, management, and storage issues as relevant to data analytics."
0.8970,"This includes an overview of relevant network protocols and cryptography; analyses of designs and implementations of security protocols, including basic tools and techniques; an understanding of network threats and attacks such as eavesdropping, spoofing, protocol failures, DoS attacks and man-in-the-middle attacks; network defence including threat analysis and identification, architecture control, intrusion detection and layered security.","This course introduces core concepts of data cleaning, standardisation, and data integration, that are aimed at converting and mapping raw data into other formats that allow more efficient and convenient use and analysis of data. The courses also discusses data quality, management, and storage issues as relevant to data analytics."
0.9283,"The course features hands-on lectures and labs to analyse network vulnerabilities, and design and implement appropriate defensive techniques.","Understand and be able to use advanced data wrangling, data integration, and database techniques as relevant to data analytics."
0.8917,Explain network security issues.,"Interpret, assess and discuss data quality measurements."
0.9002,"Understand various threats and vulnerabilities of a network, and explain appropriate countermeasures.","Understand and be able to use advanced data wrangling, data integration, and database techniques as relevant to data analytics."
0.9110,Perform simple penetration testing of a network and network services,"Justify and apply data cleaning, preprocessing, and standardisation for data analytics."
0.9043,Perform a threat analysis / vulnerability assessment of protocol designs and implementations.,Apply data integration concepts and techniques to heterogeneous and distributed data.
0.8849,Design and implement appropriate defensive countermeasures against identified threats and vulnerabilities.,Apply data integration concepts and techniques to heterogeneous and distributed data.
