score,s1,s2
0.9195,"This course studies the standard models for the layered approach to communication between autonomous machines in a network, and the main characteristics of data transmission across various physical link types.","Interpret the mathematical equations from Linear Algebra, Statistics, and Probability Theory used in these machine learning models."
0.9196,"It considers how to design networks and protocols for diverse situations, analyses several application and support protocols from a distributed systems viewpoint, and identifies significant problem areas in networked communications.","Interpret the mathematical equations from Linear Algebra, Statistics, and Probability Theory used in these machine learning models."
0.8958,"Topics include: communication network architectures, signalling and modulation across physical media, real-world local and wide-area networks, internet protocol fundamentals, performance and monitoring of networks, routing, network security, and application protocols for distributed systems including web, email, video, internet-of-everything and other contemporary network topics.","Topics covered will include Bayesian inference and maximum likelihood modeling; regression, classification, density estimation, clustering, principal and independent component analysis; parametric, semi-parametric, and non-parametric models; basis functions, neural networks, kernel methods, and graphical models; deterministic and stochastic optimisation; overfitting, regularisation, and validation."
0.9105,Understand and describe the layered protocol model.,Design test procedures in order to evaluate a model.
0.8905,"Describe, analyse and compare a number of datalink, network, and transport layer protocols.","Interpret the mathematical equations from Linear Algebra, Statistics, and Probability Theory used in these machine learning models."
0.8861,Program network communication services for client/server and other application layouts.,Design test procedures in order to evaluate a model.
0.9147,"Describe and analyse various related technical, administrative and social aspects of specific computer network protocols from standards documents and other primary materials found through research.",Design test procedures in order to evaluate a model.
0.8588,"Design and/or analyse networks and services for homes, data centres, IoT/IoE, LANs and WANs.",Design test procedures in order to evaluate a model.
