score,s1,s2
0.8848,"An introductory course in formal logic, dealing with propositional and predicate logic.",Computational Methods for Network Science covers the essentials of using computational approaches to pose and answer social science research problems.
0.9241,Techniques of formal deduction and tests for the validity of arguments will be studied.,"Analyze results from network algorithms, and articulate their limitations."
0.9033,Basic semantic concepts will be discussed.,"Analyze results from network algorithms, and articulate their limitations."
0.9184,Express reasoning problems using first order logical notation.,"Analyze results from network algorithms, and articulate their limitations."
0.9144,Construct natural deduction proofs in first order logic and translate between calculi.,"Analyze results from network algorithms, and articulate their limitations."
0.9138,Explain the relationship between rules of deduction and the semantics of logic.,Demonstrate a thorough understanding of the fundamental principles of using computational approaches to formulate and answer social science questions.
0.9390,Critically assess and compare philosophical views on issues arising from elementary logic.,"Analyze results from network algorithms, and articulate their limitations."
