score,s1,s2
0.9221,"This course studies the standard models for the layered approach to communication between autonomous machines in a network, and the main characteristics of data transmission across various physical link types.","Characterise key aspects of human-computer interaction, such as interaction design, the user experience, and user interfaces."
0.9359,"It considers how to design networks and protocols for diverse situations, analyses several application and support protocols from a distributed systems viewpoint, and identifies significant problem areas in networked communications.","Investigate the activities and practices of a design space using design research methods, to identify opportunities and issues for design intervention."
0.9171,"Topics include: communication network architectures, signalling and modulation across physical media, real-world local and wide-area networks, internet protocol fundamentals, performance and monitoring of networks, routing, network security, and application protocols for distributed systems including web, email, video, internet-of-everything and other contemporary network topics.","Characterise key aspects of human-computer interaction, such as interaction design, the user experience, and user interfaces."
0.8937,Understand and describe the layered protocol model.,"Investigate the activities and practices of a design space using design research methods, to identify opportunities and issues for design intervention."
0.8922,"Describe, analyse and compare a number of datalink, network, and transport layer protocols.","Ideate, prototype, and evaluate novel technology design ideas and their use in context."
0.8949,Program network communication services for client/server and other application layouts.,"Characterise key aspects of human-computer interaction, such as interaction design, the user experience, and user interfaces."
0.9434,"Describe and analyse various related technical, administrative and social aspects of specific computer network protocols from standards documents and other primary materials found through research.","Investigate the activities and practices of a design space using design research methods, to identify opportunities and issues for design intervention."
0.8875,"Design and/or analyse networks and services for homes, data centres, IoT/IoE, LANs and WANs.","Investigate the activities and practices of a design space using design research methods, to identify opportunities and issues for design intervention."
