score,s1,s2
0.9469,"This course studies the standard models for the layered approach to communication between autonomous machines in a network, and the main characteristics of data transmission across various physical link types.",This course delivers foundations of real-time analysis and implementation of systems which are interconnected with the physical world (embedded systems).
0.9431,"It considers how to design networks and protocols for diverse situations, analyses several application and support protocols from a distributed systems viewpoint, and identifies significant problem areas in networked communications.",This course delivers foundations of real-time analysis and implementation of systems which are interconnected with the physical world (embedded systems).
0.9366,"Topics include: communication network architectures, signalling and modulation across physical media, real-world local and wide-area networks, internet protocol fundamentals, performance and monitoring of networks, routing, network security, and application protocols for distributed systems including web, email, video, internet-of-everything and other contemporary network topics.","Real-time and embedded systems are all around us. Controlling cars, trains, or aeroplanes, as well as mobile phones, cameras, or A/V equipment, embedded systems are a challenging and demanding part of computer science and engineering."
0.9235,Understand and describe the layered protocol model.,Understand and consider constraints from physical dynamical systems.
0.9205,"Describe, analyse and compare a number of datalink, network, and transport layer protocols.","Techniques which are introduced include real-time calculus, real-time scheduling, elementary sensor data filtering and fusion methods, error recovery strategies, and graceful degradation methods."
0.9177,Program network communication services for client/server and other application layouts.,Employ standard real-time programming constructs.
0.9278,"Describe and analyse various related technical, administrative and social aspects of specific computer network protocols from standards documents and other primary materials found through research.",Participate significantly in the enhancement of the reliability (or analysis) of safety critical systems.
0.9168,"Design and/or analyse networks and services for homes, data centres, IoT/IoE, LANs and WANs.","Real-time and embedded systems are all around us. Controlling cars, trains, or aeroplanes, as well as mobile phones, cameras, or A/V equipment, embedded systems are a challenging and demanding part of computer science and engineering."
