score,s1,s2
0.9540,This course provides basic approaches for designing and analysing algorithms and data structures.,"In this course students will learn about fundamental algorithms, data structures and programming models used in 3D graphics applications."
0.9147,It will focus on two fundamental problems in computing: Sorting and searching.,"In this course students will learn about fundamental algorithms, data structures and programming models used in 3D graphics applications."
0.9394,"It will cover various data structures and algorithm design techniques for solving these two classes of problems, as well as basic performance measures and analysis techniques for solving such problems.","In this course students will learn about fundamental algorithms, data structures and programming models used in 3D graphics applications."
0.9178,"Display an advanced understanding of a variety of algorithms, including linear selection, minimum spanning trees, single source shortest path, Huffman coding, etc, with real-life applications and the resource requirements.","Construct and manipulate complex models, geometries and scene graphs in both 2D and 3D"
0.9106,"Expertly apply the most effective algorithmic techniques including dynamic programming, greedy policy, and divide-and-conquer, to solve some practical problems.","In this course students will learn about fundamental algorithms, data structures and programming models used in 3D graphics applications."
0.9278,Define and analyse time and space complexities of algorithms.,"Construct and manipulate complex models, geometries and scene graphs in both 2D and 3D"
0.9390,"Demonstrate experience in the design and implementation of algorithms for practical problems, using languages like C, C++.","In this course students will learn about fundamental algorithms, data structures and programming models used in 3D graphics applications."
