score,s1,s2
0.8901,Information theory studies the fundamental limits of the representation and transmission of information.,"These key concepts in computer graphics programming will be covered from their mathematical foundations through to their application in domains such as data visualisation, virtual reality, computer games and film animation/VFX."
0.9156,"This course provides an introduction to information theory, studying fundamental concepts such as probability, information, and entropy and examining their applications in the areas of data compression, coding, communications, pattern recognition and probabilistic inference.","These key concepts in computer graphics programming will be covered from their mathematical foundations through to their application in domains such as data visualisation, virtual reality, computer games and film animation/VFX."
0.9164,"Understand and apply fundamental concepts in information theory such as probability, entropy, information content and their inter-relationships.","These key concepts in computer graphics programming will be covered from their mathematical foundations through to their application in domains such as data visualisation, virtual reality, computer games and film animation/VFX."
0.8941,Understand the principles of data compression.,"In this course students will learn about fundamental algorithms, data structures and programming models used in 3D graphics applications."
0.8584,Compute entropy and mutual information of random variables.,"Construct and manipulate complex models, geometries and scene graphs in both 2D and 3D"
0.9162,Implement and analyse basic coding and compression algorithms.,"In this course students will learn about fundamental algorithms, data structures and programming models used in 3D graphics applications."
0.9179,Understand the relationship of information theoretical principles and Bayesian inference in data modelling and pattern recognition.,"These key concepts in computer graphics programming will be covered from their mathematical foundations through to their application in domains such as data visualisation, virtual reality, computer games and film animation/VFX."
0.9035,"Understand some key theorems and inequalities that quantify essential limitations on compression, communication and inference.",In this course students will explore these concepts through practical implementation in a modern computer graphics software context.
0.9120,Know the basic concepts regarding communications over noisy channels.,In this course students will explore these concepts through practical implementation in a modern computer graphics software context.
