score,s1,s2
0.8769,Computer graphics are an essential part of modern software.,This includes demonstrated skills in the writing of abstracts and research papers.
0.9287,"In this course students will learn about fundamental algorithms, data structures and programming models used in 3D graphics applications.",The course introduces students to some fundamentals of research methodology.
0.9216,"These key concepts in computer graphics programming will be covered from their mathematical foundations through to their application in domains such as data visualisation, virtual reality, computer games and film animation/VFX.","This includes different tasks such as topic modelling, statistical analysis, applying different machine learning techniques to solve a problem in a team, proving theorems, complexity analysis, designing a research project, reviewing papers and presenting papers."
0.9405,In this course students will explore these concepts through practical implementation in a modern computer graphics software context.,The course introduces students to some fundamentals of research methodology.
0.8858,"Explain the stages of a modern, hardware-accelerated 3D rendering pipeline","This includes different tasks such as topic modelling, statistical analysis, applying different machine learning techniques to solve a problem in a team, proving theorems, complexity analysis, designing a research project, reviewing papers and presenting papers."
0.9157,"Construct and manipulate complex models, geometries and scene graphs in both 2D and 3D","This includes different tasks such as topic modelling, statistical analysis, applying different machine learning techniques to solve a problem in a team, proving theorems, complexity analysis, designing a research project, reviewing papers and presenting papers."
0.8826,Implement computer graphics algorithms in a shader language,"This includes different tasks such as topic modelling, statistical analysis, applying different machine learning techniques to solve a problem in a team, proving theorems, complexity analysis, designing a research project, reviewing papers and presenting papers."
