score,s1,s2
0.8894,This course provides a broad but thorough introduction to the methods and practice of statistical machine learning.,"An introductory course in formal logic, dealing with propositional and predicate logic."
0.8873,"Topics covered will include Bayesian inference and maximum likelihood modeling; regression, classification, density estimation, clustering, principal and independent component analysis; parametric, semi-parametric, and non-parametric models; basis functions, neural networks, kernel methods, and graphical models; deterministic and stochastic optimisation; overfitting, regularisation, and validation.",Techniques of formal deduction and tests for the validity of arguments will be studied.
0.8810,"Describe a number of models for supervised, unsupervised, and reinforcement machine learning.",Techniques of formal deduction and tests for the validity of arguments will be studied.
0.8971,Assess the strength and weakness of each of these models.,Critically assess and compare philosophical views on issues arising from elementary logic.
0.9274,"Interpret the mathematical equations from Linear Algebra, Statistics, and Probability Theory used in these machine learning models.",Construct natural deduction proofs in first order logic and translate between calculi.
0.8879,Implement efficient machine learning algorithms on a computer.,Express reasoning problems using first order logical notation.
0.9086,Design test procedures in order to evaluate a model.,Techniques of formal deduction and tests for the validity of arguments will be studied.
0.8972,Combine several models in order to gain better results.,Techniques of formal deduction and tests for the validity of arguments will be studied.
0.9247,Make choices for a model for new machine learning tasks based on reasoned argument.,Techniques of formal deduction and tests for the validity of arguments will be studied.
