score,s1,s2
0.8945,A practically oriented introduction to programming paradigms for parallel computers.,The course introduces students to some fundamentals of research methodology.
0.9197,"Considers definitions of program efficiency on parallel computers, addresses the modelling, analysis and measurement of program performance.","This includes different tasks such as topic modelling, statistical analysis, applying different machine learning techniques to solve a problem in a team, proving theorems, complexity analysis, designing a research project, reviewing papers and presenting papers."
0.8980,"Description, implementation and use of parallel programming languages, parallel features of operating systems, library routines and applications.","This includes different tasks such as topic modelling, statistical analysis, applying different machine learning techniques to solve a problem in a team, proving theorems, complexity analysis, designing a research project, reviewing papers and presenting papers."
0.8923,Be proficient at programming multiple parallel machines in more than one special programming language or programming system.,"This includes different tasks such as topic modelling, statistical analysis, applying different machine learning techniques to solve a problem in a team, proving theorems, complexity analysis, designing a research project, reviewing papers and presenting papers."
0.9177,Be able to descriptively compare the performance of different programs and methods on one machine,"This includes different tasks such as topic modelling, statistical analysis, applying different machine learning techniques to solve a problem in a team, proving theorems, complexity analysis, designing a research project, reviewing papers and presenting papers."
0.9223,Demonstrate advanced knowledge of the elements of parallel programming language and system implementation.,"Demonstrate an ability to communicate in relation to an computing project in oral, written and graphical forms, with an an appreciation of the need to pitch any communication item appropriately for the audience."
0.9172,Recall the history of parallel systems and describe the developments in the field.,Understanding of the process of identifying and formulating research problems.
