score,s1,s2
0.8786,"Massive amounts of data are being collected by public and private organisations, and research projects, while the Internet provides a very large source of information about almost every aspect of human life and society.",Demonstrate a thorough understanding of the fundamental principles underlying the identification and testing for vulnerabilities with limited information.
0.9115,Analysing such data can provide significant benefits to an organisation.,Demonstrate a thorough understanding of the fundamental principles underlying the identification and testing for vulnerabilities with limited information.
0.9259,This course provides a practical focus on the technology and research in the area of data mining.,This is a complete course in cyber attacks which enables students on successful completion to identify and test systems for vulnerabilities without full knowledge or direct access.
0.9131,It focuses on the algorithms and techniques and less on the mathematical and statistical foundations.,Offensive Cyber Security operations introduces and exercises a complete range of reverse engineering techniques and attack patterns. Students will also learn and exercise analysis of systems based on minimal information.
0.9184,Critically analyse and justify the steps involved in the data mining process.,Offensive Cyber Security operations introduces and exercises a complete range of reverse engineering techniques and attack patterns. Students will also learn and exercise analysis of systems based on minimal information.
0.9184,Anticipate and identify data issues related to data mining.,Communicate a cyber security vulnerability and potential paths of attack to a heterogenous team of professionals.
0.9299,Test and apply the principal algorithms and techniques used in data mining.,Offensive Cyber Security operations introduces and exercises a complete range of reverse engineering techniques and attack patterns. Students will also learn and exercise analysis of systems based on minimal information.
0.9172,Justify suitable techniques to use for a given data mining problem.,Expand conventional attack patterns to work in new system and network architectures.
0.9186,Appraise and reflect upon the results of a data mining project using suitable measurements.,Offensive Cyber Security operations introduces and exercises a complete range of reverse engineering techniques and attack patterns. Students will also learn and exercise analysis of systems based on minimal information.
0.9025,Reflect upon ethical and social impacts of data mining.,Demonstrate a thorough understanding of the fundamental principles underlying the identification and testing for vulnerabilities with limited information.
