score,s1,s2
0.9387,This course is an introduction to relational databases and the general skills for designing and using them.,This course provides a broad but thorough introduction to the methods and practice of statistical machine learning.
0.9180,"The topics include the relational data model, SQL, entity-relationship model, functional dependencies, (de-)normalisation, relational algebra, query processing and optimisation, database transactions and security.","Topics covered will include Bayesian inference and maximum likelihood modeling; regression, classification, density estimation, clustering, principal and independent component analysis; parametric, semi-parametric, and non-parametric models; basis functions, neural networks, kernel methods, and graphical models; deterministic and stochastic optimisation; overfitting, regularisation, and validation."
0.9022,"To deepen the understanding of relational databases, the current industry development of database systems such as NoSQL databases will be introduced at the end of this course.","Interpret the mathematical equations from Linear Algebra, Statistics, and Probability Theory used in these machine learning models."
0.9149,Describe the basic concepts of the relational model and understand its mathematical foundation;,"Interpret the mathematical equations from Linear Algebra, Statistics, and Probability Theory used in these machine learning models."
0.8317,"Use the SQL language to define, query and manipulate a relational database.",Implement efficient machine learning algorithms on a computer.
0.9061,Apply conceptual database modelling methods such as entity-relationship model to design a relational database.,"Interpret the mathematical equations from Linear Algebra, Statistics, and Probability Theory used in these machine learning models."
0.9202,Apply database design methods on functional dependencies and normal forms to evaluate the quality of a relational database design.,Make choices for a model for new machine learning tasks based on reasoned argument.
0.8958,"Understand query processing and optimization, transaction and security management in a relational database management system.","Interpret the mathematical equations from Linear Algebra, Statistics, and Probability Theory used in these machine learning models."
0.8840,"Understand the state of the art of database management systems, and big data management challenges (Amazon's Dynamo, Google's BigTable, MongoDB and MapReduce).","Interpret the mathematical equations from Linear Algebra, Statistics, and Probability Theory used in these machine learning models."
