score,s1,s2
0.9104,Computer graphics are an essential part of modern software.,This course delivers foundations of real-time analysis and implementation of systems which are interconnected with the physical world (embedded systems).
0.9431,"In this course students will learn about fundamental algorithms, data structures and programming models used in 3D graphics applications.",This course delivers foundations of real-time analysis and implementation of systems which are interconnected with the physical world (embedded systems).
0.9357,"These key concepts in computer graphics programming will be covered from their mathematical foundations through to their application in domains such as data visualisation, virtual reality, computer games and film animation/VFX.",This course delivers foundations of real-time analysis and implementation of systems which are interconnected with the physical world (embedded systems).
0.9398,In this course students will explore these concepts through practical implementation in a modern computer graphics software context.,This course delivers foundations of real-time analysis and implementation of systems which are interconnected with the physical world (embedded systems).
0.9173,"Explain the stages of a modern, hardware-accelerated 3D rendering pipeline",This course delivers foundations of real-time analysis and implementation of systems which are interconnected with the physical world (embedded systems).
0.9186,"Construct and manipulate complex models, geometries and scene graphs in both 2D and 3D",Understand and consider constraints from physical dynamical systems.
0.9275,Implement computer graphics algorithms in a shader language,Employ standard real-time programming constructs.
