score,s1,s2
0.9202,Information theory studies the fundamental limits of the representation and transmission of information.,Explain the relationship between rules of deduction and the semantics of logic.
0.8936,"This course provides an introduction to information theory, studying fundamental concepts such as probability, information, and entropy and examining their applications in the areas of data compression, coding, communications, pattern recognition and probabilistic inference.",Explain the relationship between rules of deduction and the semantics of logic.
0.9250,"Understand and apply fundamental concepts in information theory such as probability, entropy, information content and their inter-relationships.",Explain the relationship between rules of deduction and the semantics of logic.
0.8871,Understand the principles of data compression.,Express reasoning problems using first order logical notation.
0.8729,Compute entropy and mutual information of random variables.,Express reasoning problems using first order logical notation.
0.9006,Implement and analyse basic coding and compression algorithms.,Construct natural deduction proofs in first order logic and translate between calculi.
0.9351,Understand the relationship of information theoretical principles and Bayesian inference in data modelling and pattern recognition.,Explain the relationship between rules of deduction and the semantics of logic.
0.9346,"Understand some key theorems and inequalities that quantify essential limitations on compression, communication and inference.",Critically assess and compare philosophical views on issues arising from elementary logic.
0.9076,Know the basic concepts regarding communications over noisy channels.,Basic semantic concepts will be discussed.
