score,s1,s2
0.9274,"This course studies the standard models for the layered approach to communication between autonomous machines in a network, and the main characteristics of data transmission across various physical link types.","To deepen the understanding of relational databases, the current industry development of database systems such as NoSQL databases will be introduced at the end of this course."
0.9345,"It considers how to design networks and protocols for diverse situations, analyses several application and support protocols from a distributed systems viewpoint, and identifies significant problem areas in networked communications.","To deepen the understanding of relational databases, the current industry development of database systems such as NoSQL databases will be introduced at the end of this course."
0.9308,"Topics include: communication network architectures, signalling and modulation across physical media, real-world local and wide-area networks, internet protocol fundamentals, performance and monitoring of networks, routing, network security, and application protocols for distributed systems including web, email, video, internet-of-everything and other contemporary network topics.","The topics include the relational data model, SQL, entity-relationship model, functional dependencies, (de-)normalisation, relational algebra, query processing and optimisation, database transactions and security."
0.9231,Understand and describe the layered protocol model.,Describe the basic concepts of the relational model and understand its mathematical foundation;
0.9203,"Describe, analyse and compare a number of datalink, network, and transport layer protocols.","The topics include the relational data model, SQL, entity-relationship model, functional dependencies, (de-)normalisation, relational algebra, query processing and optimisation, database transactions and security."
0.9237,Program network communication services for client/server and other application layouts.,"Understand query processing and optimization, transaction and security management in a relational database management system."
0.9313,"Describe and analyse various related technical, administrative and social aspects of specific computer network protocols from standards documents and other primary materials found through research.","To deepen the understanding of relational databases, the current industry development of database systems such as NoSQL databases will be introduced at the end of this course."
0.8948,"Design and/or analyse networks and services for homes, data centres, IoT/IoE, LANs and WANs.","Understand the state of the art of database management systems, and big data management challenges (Amazon's Dynamo, Google's BigTable, MongoDB and MapReduce)."
