score,s1,s2
0.8814,"Software Security covers advanced techniques in software vulnerability assessment, discovery and mitigation.","These key concepts in computer graphics programming will be covered from their mathematical foundations through to their application in domains such as data visualisation, virtual reality, computer games and film animation/VFX."
0.8798,"These include: common patterns in software vulnerabilities, such as stack-based buffer overflow, format string vulnerabilities, and heap-based vulnerabilities; exploitation techniques such as code injection, return-oriented-programming; techniques for vulnerability discovery, such as program binaries reverse engineering, fuzzing and symbolic execution; and mitigation techniques such as memory protection mechanisms, input sanitation, and control flow integrity protection.","These key concepts in computer graphics programming will be covered from their mathematical foundations through to their application in domains such as data visualisation, virtual reality, computer games and film animation/VFX."
0.9220,"The course features hands-on lectures and labs to analyse software vulnerabilities, both in the source code and in program binaries, and design and implement appropriate mitigation techniques.","In this course students will learn about fundamental algorithms, data structures and programming models used in 3D graphics applications."
0.8929,Demonstrate a thorough understanding of common sources of vulnerabilities in software.,"In this course students will learn about fundamental algorithms, data structures and programming models used in 3D graphics applications."
0.9119,Demonstrate a thorough understanding in exploitation techniques against software vulnerabilities and defensive techniques against these exploitations.,In this course students will explore these concepts through practical implementation in a modern computer graphics software context.
0.9189,Demonstrate proficiency in software reverse engineering.,In this course students will explore these concepts through practical implementation in a modern computer graphics software context.
0.9211,"Demonstrate proficiency in vulnerability discovery processes, from both source code and binary.",In this course students will explore these concepts through practical implementation in a modern computer graphics software context.
0.9073,"Apply the vulnerability discovery techniques to real-world software, analyse their vulnerabilities and design and implement appropriate mitigation techniques.",In this course students will explore these concepts through practical implementation in a modern computer graphics software context.
