score,s1,s2
0.8993,Cyber Security Foundations introduces all essential cyber security principles.,"The course also aims to give an overview of the historical, philosophical, and logical foundations of AI."
0.9101,"This includes principles of secure design, secrets minimization, least privilege, isolation, separation and encapsulation.","The focus of this course is on core AI techniques for search, knowledge representation and reasoning, planning, and designing intelligent agents."
0.9020,The interplay between failed security principles and vulnerabilities is investigated in detail.,"The course also aims to give an overview of the historical, philosophical, and logical foundations of AI."
0.9184,"The course provides the essential foundations which allow students to continue in a more in-depth cyber security career, yet can also be used a standalone unit to provide a self-contained set of knowledge.","The focus of this course is on core AI techniques for search, knowledge representation and reasoning, planning, and designing intelligent agents."
0.9203,Demonstrate a thorough understanding of the fundamental principles underlying Cyber Security.,"The course also aims to give an overview of the historical, philosophical, and logical foundations of AI."
0.9038,Define and identify cyber security principles and their violation.,"Design and perform an empirical evaluation of different algorithms on a problem formalisation, and state the conclusions that the evaluation supports."
0.9125,Apply cyber security principles in a practical context.,"The focus of this course is on core AI techniques for search, knowledge representation and reasoning, planning, and designing intelligent agents."
0.9090,Migrate insights from cyber security analysis into new designs.,"Design and perform an empirical evaluation of different algorithms on a problem formalisation, and state the conclusions that the evaluation supports."
0.8928,Communicate a cyber security thread to a heterogenous team of professionals.,"Design and perform an empirical evaluation of different algorithms on a problem formalisation, and state the conclusions that the evaluation supports."
