score,s1,s2
0.9074,"This course takes a detailed look at the services provided by, and the internals of, an existing operating system to see how each part is constructed and integrated into the whole.",identify and explain the activities involved in each phase of the Systems Engineering life-cycle.
0.8910,The lectures will also address recent literature describing advances in operating systems.,explain the role of Software Engineering within the broader context of Systems Engineering.
0.9172,"The following topics are addressed: system programming and its facilities (including I/O, signals, job control, interprocess communication, sockets, transport layers, remote operations), system calls and their relation to the system libraries, process management and coordination, implementation of message passing, memory management, interrupt handling, real-time clocks, device-independent input/output, serial-line drivers, network communication, disk drivers, deadlock avoidance, scheduling paradigms, file systems, security.","Conceptual system design: including problem definition, technical performance measures, quality function deployment (QFD), trade-off analyses, and system specification."
0.9086,"identify and evaluate features of the system library of a particular operating system, and be able to apply this knowledge to program small applications.","Conceptual system design: including problem definition, technical performance measures, quality function deployment (QFD), trade-off analyses, and system specification."
0.9020,describe and analyse the actual algorithms and data structures that are used in a particular operating system.,"Because software is a critical component of such systems, Software Engineers will often work in Systems Engineering teams."
0.9194,"define and analyse the structure of operating systems in general, especially those that support communicating processes.","Because software is a critical component of such systems, Software Engineers will often work in Systems Engineering teams."
0.9225,identify and describe the reasons for many architectural features of contemporary machines.,describe the holistic and multi-disciplinary nature of complex engineering projects.
0.9275,demonstrate experience in the design and implementation of a large software system.,describe the holistic and multi-disciplinary nature of complex engineering projects.
