score,s1,s2
0.9070,"An introductory course in formal logic, dealing with propositional and predicate logic.",This course teaches introductory programming within a problem solving framework applicable to the sciences.
0.9109,Techniques of formal deduction and tests for the validity of arguments will be studied.,"The course emphasises technical programming, the simulation of scientific systems and the processing of scientific data."
0.8964,Basic semantic concepts will be discussed.,Have an understanding of some widely-used algorithms.
0.9164,Express reasoning problems using first order logical notation.,This course teaches introductory programming within a problem solving framework applicable to the sciences.
0.9068,Construct natural deduction proofs in first order logic and translate between calculi.,Have an understanding of practical aspects of machine architecture including finite precision and rounding errors.
0.9047,Explain the relationship between rules of deduction and the semantics of logic.,Have a practical understanding of the processing of scientific data.
0.9134,Critically assess and compare philosophical views on issues arising from elementary logic.,This course teaches introductory programming within a problem solving framework applicable to the sciences.
