score,s1,s2
0.8905,A practically oriented introduction to programming paradigms for parallel computers.,Systems concepts.
0.9299,"Considers definitions of program efficiency on parallel computers, addresses the modelling, analysis and measurement of program performance.","Conceptual system design: including problem definition, technical performance measures, quality function deployment (QFD), trade-off analyses, and system specification."
0.9045,"Description, implementation and use of parallel programming languages, parallel features of operating systems, library routines and applications.","Conceptual system design: including problem definition, technical performance measures, quality function deployment (QFD), trade-off analyses, and system specification."
0.8848,Be proficient at programming multiple parallel machines in more than one special programming language or programming system.,"Because software is a critical component of such systems, Software Engineers will often work in Systems Engineering teams."
0.9067,Be able to descriptively compare the performance of different programs and methods on one machine,"Conceptual system design: including problem definition, technical performance measures, quality function deployment (QFD), trade-off analyses, and system specification."
0.9296,Demonstrate advanced knowledge of the elements of parallel programming language and system implementation.,"Conceptual system design: including problem definition, technical performance measures, quality function deployment (QFD), trade-off analyses, and system specification."
0.9123,Recall the history of parallel systems and describe the developments in the field.,describe the Systems Engineering life-cycle.
