score,s1,s2
0.9306,"This course will provide an introduction to the field of Human-Computer Interaction and will introduce students to key interaction and experience design paradigms, approaches and methods.",The course introduces students to some fundamentals of research methodology.
0.9427,"The course will equip students with theory, methods, and techniques to investigate different design situations, develop novel design ideas, and ask critical questions about the role of technology in society.","The lectures will be complemented by a series of workshops, labs and assignments that require students to do some small research focused tasks that help them get a hands-on experience of research, both individually and in teams of students."
0.9032,"Characterise key aspects of human-computer interaction, such as interaction design, the user experience, and user interfaces.",Understanding of the process of identifying and formulating research problems.
0.9236,"Differentiate between design paradigms, approaches, and methods and explain their applicability to different design contexts.",Demonstrate an awareness of the existence of technological choices; and make appropriate choices based on a consideration of design criteria.
0.9466,"Investigate the activities and practices of a design space using design research methods, to identify opportunities and issues for design intervention.",Demonstrate an awareness of the existence of technological choices; and make appropriate choices based on a consideration of design criteria.
0.9232,"Ideate, prototype, and evaluate novel technology design ideas and their use in context.",Demonstrate an awareness of the existence of technological choices; and make appropriate choices based on a consideration of design criteria.
0.9121,"Critically reflect on the role of technology in society, including issues of power, agency, and representation in design.",Demonstrate an awareness of the existence of technological choices; and make appropriate choices based on a consideration of design criteria.
