score,s1,s2
0.8996,"This course takes a detailed look at the services provided by, and the internals of, an existing operating system to see how each part is constructed and integrated into the whole.","Throughout the course there will be meetings where students discuss all aspects of their projects, as well as a set of lectures about different aspects of being a successful researcher."
0.9222,The lectures will also address recent literature describing advances in operating systems.,Understand the main principles and concepts in at least two areas of computer science that are being actively shaped by research.
0.8545,"The following topics are addressed: system programming and its facilities (including I/O, signals, job control, interprocess communication, sockets, transport layers, remote operations), system calls and their relation to the system libraries, process management and coordination, implementation of message passing, memory management, interrupt handling, real-time clocks, device-independent input/output, serial-line drivers, network communication, disk drivers, deadlock avoidance, scheduling paradigms, file systems, security.",Understand the main principles and concepts in at least two areas of computer science that are being actively shaped by research.
0.9036,"identify and evaluate features of the system library of a particular operating system, and be able to apply this knowledge to program small applications.",Have a basis of the knowledge and skills in research projects that can be built upon for more substantial projects.
0.8867,describe and analyse the actual algorithms and data structures that are used in a particular operating system.,Understand the main principles and concepts in at least two areas of computer science that are being actively shaped by research.
0.8901,"define and analyse the structure of operating systems in general, especially those that support communicating processes.",Understand the main principles and concepts in at least two areas of computer science that are being actively shaped by research.
0.9241,identify and describe the reasons for many architectural features of contemporary machines.,Understand the main principles and concepts in at least two areas of computer science that are being actively shaped by research.
0.9148,demonstrate experience in the design and implementation of a large software system.,This course provides students with hands-on experience of being a researcher in the computing discipline.
