score,s1,s2
0.8976,"This course will provide an introduction to the field of Human-Computer Interaction and will introduce students to key interaction and experience design paradigms, approaches and methods.",Demonstrate an understanding of theoretical foundations of convex optimization and be able to use it to characterize optimal solutions to general problems.
0.9118,"The course will equip students with theory, methods, and techniques to investigate different design situations, develop novel design ideas, and ask critical questions about the role of technology in society.",Demonstrate an understanding of theoretical foundations of convex optimization and be able to use it to characterize optimal solutions to general problems.
0.8829,"Characterise key aspects of human-computer interaction, such as interaction design, the user experience, and user interfaces.",Demonstrate an understanding of theoretical foundations of convex optimization and be able to use it to characterize optimal solutions to general problems.
0.9135,"Differentiate between design paradigms, approaches, and methods and explain their applicability to different design contexts.",Demonstrate an understanding of theoretical foundations of convex optimization and be able to use it to characterize optimal solutions to general problems.
0.9185,"Investigate the activities and practices of a design space using design research methods, to identify opportunities and issues for design intervention.",Be able to use a variety of meta-heuristics to escape local minima in a neighbourhood.
0.8990,"Ideate, prototype, and evaluate novel technology design ideas and their use in context.",Be able to recognize and formulate convex optimization problems arising in practice.
0.8804,"Critically reflect on the role of technology in society, including issues of power, agency, and representation in design.",Be able to use a variety of meta-heuristics to escape local minima in a neighbourhood.
