score,s1,s2
0.9082,Data communications and computer networking systems are growing rapidly in both size and function. It is impossible to think of a successful business day without the Internet.,Commerce and research are being transformed by data-driven discovery and prediction.
0.8999,"Modern communication technologies such as WiFi, Bring Your Own Device (BYOD), and Internet of Things (IoT) help us to stay connected with our family, friends, and work regardless of present location.","Skills required for data analytics at massive levels – scalable data management on and off the cloud, parallel algorithms, statistical modeling, and proficiency with a complex ecosystem of tools and platforms – span a variety of disciplines and are not easy to obtain through conventional curricula."
0.9164,"Networked Information Systems (NISs) are becoming an essential part of everyday experiences, in our kitchen appliances, cars, and public transport and for Internet banking and shopping.","Skills required for data analytics at massive levels – scalable data management on and off the cloud, parallel algorithms, statistical modeling, and proficiency with a complex ecosystem of tools and platforms – span a variety of disciplines and are not easy to obtain through conventional curricula."
0.9025,"Because they can make or break a day, understanding how networks work, and how they should be set up and managed to for reliability, scalability, mobility, and security is of the utmost importance to us.","Skills required for data analytics at massive levels – scalable data management on and off the cloud, parallel algorithms, statistical modeling, and proficiency with a complex ecosystem of tools and platforms – span a variety of disciplines and are not easy to obtain through conventional curricula."
0.9424,"In this course, you will learn fundamental concepts of data communication and networking in addition to gaining a working knowledge of network scalability, mobility, security, and managing capabilities.","Skills required for data analytics at massive levels – scalable data management on and off the cloud, parallel algorithms, statistical modeling, and proficiency with a complex ecosystem of tools and platforms – span a variety of disciplines and are not easy to obtain through conventional curricula."
0.9154,"You will have the foundational basis to understand, evaluate, and compare new technologies and their applications.","Demonstrate basic knowledge and understanding of descriptive and predictive data analysis methods, optimization and search, and knowledge representation."
0.9350,"You will also develop a working knowledge of measuring risks and security threats and considering network monitoring and management procedures. Finally, you will build an ethics awareness and the communication skills needed to apply these networking concepts to a range of real-life analytical scenarios.","Skills required for data analytics at massive levels – scalable data management on and off the cloud, parallel algorithms, statistical modeling, and proficiency with a complex ecosystem of tools and platforms – span a variety of disciplines and are not easy to obtain through conventional curricula."
0.9337,"Discuss how network applications and their components work in real-life socio-economic, ethical, and legal contexts and evaluate their risks.","Identify potential pitfalls, and social and ethical implications of data science."
0.9219,"Analyse the role of network standards, protocols, and layered models.","Explain key security concepts and the use of cryptographic techniques, digital signatures and PKI in security."
0.9194,"Apply network design principles, topologies, architectures, and their components.","Demonstrate basic knowledge and understanding of descriptive and predictive data analysis methods, optimization and search, and knowledge representation."
0.9128,Apply logical and physical networks at levels from the local area to the Internet.,"Skills required for data analytics at massive levels – scalable data management on and off the cloud, parallel algorithms, statistical modeling, and proficiency with a complex ecosystem of tools and platforms – span a variety of disciplines and are not easy to obtain through conventional curricula."
0.9127,Create a virtual machine and apply tools for packet analysis and file encryption in a lab environment.,"Demonstrate a conceptual understanding of database systems and architecture, data models and declarative query languages"
