score,s1,s2
0.9246,Offensive Cyber Security operations introduces and exercises a complete range of reverse engineering techniques and attack patterns. Students will also learn and exercise analysis of systems based on minimal information.,be competent in experimental computing in a numerical context and of the optimisation of algorithms on high performance architectures.
0.9201,This is a complete course in cyber attacks which enables students on successful completion to identify and test systems for vulnerabilities without full knowledge or direct access.,It will also look at practical methods of estimating and measuring algorithm/architecture performance.
0.9205,Demonstrate a thorough understanding of the fundamental principles underlying the identification and testing for vulnerabilities with limited information.,demonstrate a basic knowledge of numerical computing using an appropriate programming language.
0.9274,"Analyze a system across all abstraction levels, from basic hardware to complex cloud architectures.",have an understanding of the various paradigms of high performance computing and their potential for performance and programmability.
0.9121,"Run cyber attacks, tests and probes in a practical context.",be competent in experimental computing in a numerical context and of the optimisation of algorithms on high performance architectures.
0.9358,Expand conventional attack patterns to work in new system and network architectures.,be competent in experimental computing in a numerical context and of the optimisation of algorithms on high performance architectures.
0.9081,Communicate a cyber security vulnerability and potential paths of attack to a heterogenous team of professionals.,have an understanding of the various paradigms of high performance computing and their potential for performance and programmability.
