score,s1,s2
0.9021,"This course covers a range of concepts, techniques and technologies in network security.","Explain key security concepts and the use of cryptographic techniques, digital signatures and PKI in security."
0.9153,"This includes an overview of relevant network protocols and cryptography; analyses of designs and implementations of security protocols, including basic tools and techniques; an understanding of network threats and attacks such as eavesdropping, spoofing, protocol failures, DoS attacks and man-in-the-middle attacks; network defence including threat analysis and identification, architecture control, intrusion detection and layered security.","Explain key security concepts and the use of cryptographic techniques, digital signatures and PKI in security."
0.9297,"The course features hands-on lectures and labs to analyse network vulnerabilities, and design and implement appropriate defensive techniques.","Skills required for data analytics at massive levels – scalable data management on and off the cloud, parallel algorithms, statistical modeling, and proficiency with a complex ecosystem of tools and platforms – span a variety of disciplines and are not easy to obtain through conventional curricula."
0.9039,Explain network security issues.,Learn key concepts in security and the use of cryptographic techniques in securing data.
0.9111,"Understand various threats and vulnerabilities of a network, and explain appropriate countermeasures.","Identify potential pitfalls, and social and ethical implications of data science."
0.9156,Perform simple penetration testing of a network and network services,Apply their knowledge to a given problem domain and articulate potential data analysis problems.
0.9082,Perform a threat analysis / vulnerability assessment of protocol designs and implementations.,"Explain key security concepts and the use of cryptographic techniques, digital signatures and PKI in security."
0.8922,Design and implement appropriate defensive countermeasures against identified threats and vulnerabilities.,"Identify potential pitfalls, and social and ethical implications of data science."
