score,s1,s2
0.9336,"This course studies the standard models for the layered approach to communication between autonomous machines in a network, and the main characteristics of data transmission across various physical link types.","It will cover various data structures and algorithm design techniques for solving these two classes of problems, as well as basic performance measures and analysis techniques for solving such problems."
0.9522,"It considers how to design networks and protocols for diverse situations, analyses several application and support protocols from a distributed systems viewpoint, and identifies significant problem areas in networked communications.","It will cover various data structures and algorithm design techniques for solving these two classes of problems, as well as basic performance measures and analysis techniques for solving such problems."
0.9210,"Topics include: communication network architectures, signalling and modulation across physical media, real-world local and wide-area networks, internet protocol fundamentals, performance and monitoring of networks, routing, network security, and application protocols for distributed systems including web, email, video, internet-of-everything and other contemporary network topics.","Display an advanced understanding of a variety of algorithms, including linear selection, minimum spanning trees, single source shortest path, Huffman coding, etc, with real-life applications and the resource requirements."
0.9132,Understand and describe the layered protocol model.,Define and analyse time and space complexities of algorithms.
0.9179,"Describe, analyse and compare a number of datalink, network, and transport layer protocols.",Define and analyse time and space complexities of algorithms.
0.8983,Program network communication services for client/server and other application layouts.,"Demonstrate experience in the design and implementation of algorithms for practical problems, using languages like C, C++."
0.9242,"Describe and analyse various related technical, administrative and social aspects of specific computer network protocols from standards documents and other primary materials found through research.",Define and analyse time and space complexities of algorithms.
0.8815,"Design and/or analyse networks and services for homes, data centres, IoT/IoE, LANs and WANs.","Display an advanced understanding of a variety of algorithms, including linear selection, minimum spanning trees, single source shortest path, Huffman coding, etc, with real-life applications and the resource requirements."
