score,s1,s2
0.8679,"An introductory course in formal logic, dealing with propositional and predicate logic.","define and analyse the structure of operating systems in general, especially those that support communicating processes."
0.8867,Techniques of formal deduction and tests for the validity of arguments will be studied.,identify and describe the reasons for many architectural features of contemporary machines.
0.9116,Basic semantic concepts will be discussed.,The lectures will also address recent literature describing advances in operating systems.
0.8895,Express reasoning problems using first order logical notation.,identify and describe the reasons for many architectural features of contemporary machines.
0.8794,Construct natural deduction proofs in first order logic and translate between calculi.,"define and analyse the structure of operating systems in general, especially those that support communicating processes."
0.8807,Explain the relationship between rules of deduction and the semantics of logic.,identify and describe the reasons for many architectural features of contemporary machines.
0.9195,Critically assess and compare philosophical views on issues arising from elementary logic.,identify and describe the reasons for many architectural features of contemporary machines.
