score,s1,s2
1.0000,"This course presents some formal notations that are commonly used for the description of computation and of computing systems, for the specification of software and for mathematically rigorous arguments about program properties.","This course presents some formal notations that are commonly used for the description of computation and of computing systems, for the specification of software and for mathematically rigorous arguments about program properties."
1.0000,"The following areas of study constitute the backbone of the course. Predicate calculus and natural deduction, inductive definitions of data types as a basis for recursive functions and structural induction, formal language theory (particularly regular expressions, finite state machines and context free grammars), and specification languages.","The following areas of study constitute the backbone of the course. Predicate calculus and natural deduction, inductive definitions of data types as a basis for recursive functions and structural induction, formal language theory (particularly regular expressions, finite state machines and context free grammars), and specification languages."
1.0000,"Apply the concepts of standard mathematical logic to produce proofs or refutations of well-formed propositions or arguments phrased in English or in a variety of formal notations (first order logic, discrete mathematics or Hoare Logic).","Apply the concepts of standard mathematical logic to produce proofs or refutations of well-formed propositions or arguments phrased in English or in a variety of formal notations (first order logic, discrete mathematics or Hoare Logic)."
1.0000,"Given a description of a regular language, either in English, as a regular expression or as a grammar, generate a finite state automaton that recognizes that language. Similarly, given a deterministic or nondeterministic automaton, give a description of the language which it accepts.","Given a description of a regular language, either in English, as a regular expression or as a grammar, generate a finite state automaton that recognizes that language. Similarly, given a deterministic or nondeterministic automaton, give a description of the language which it accepts."
1.0000,"Given an inductive definition of a simple data structure, write a recursive definition of a given simple operation on data of that type. Given some such recursively defined operations, prove simple properties of these functions using the appropriate structural induction principle.","Given an inductive definition of a simple data structure, write a recursive definition of a given simple operation on data of that type. Given some such recursively defined operations, prove simple properties of these functions using the appropriate structural induction principle."
1.0000,Prove simple programs correct using Hoare Logic.,Prove simple programs correct using Hoare Logic.
1.0000,Design a Turing Machine which will accomplish simple tasks.,Design a Turing Machine which will accomplish simple tasks.
