score,s1,s2
0.8722,"This course covers a range of concepts, techniques and technologies in network security.",Basic semantic concepts will be discussed.
0.8515,"This includes an overview of relevant network protocols and cryptography; analyses of designs and implementations of security protocols, including basic tools and techniques; an understanding of network threats and attacks such as eavesdropping, spoofing, protocol failures, DoS attacks and man-in-the-middle attacks; network defence including threat analysis and identification, architecture control, intrusion detection and layered security.",Techniques of formal deduction and tests for the validity of arguments will be studied.
0.8929,"The course features hands-on lectures and labs to analyse network vulnerabilities, and design and implement appropriate defensive techniques.",Critically assess and compare philosophical views on issues arising from elementary logic.
0.8895,Explain network security issues.,Basic semantic concepts will be discussed.
0.8732,"Understand various threats and vulnerabilities of a network, and explain appropriate countermeasures.",Critically assess and compare philosophical views on issues arising from elementary logic.
0.8832,Perform simple penetration testing of a network and network services,Critically assess and compare philosophical views on issues arising from elementary logic.
0.8824,Perform a threat analysis / vulnerability assessment of protocol designs and implementations.,Techniques of formal deduction and tests for the validity of arguments will be studied.
0.8544,Design and implement appropriate defensive countermeasures against identified threats and vulnerabilities.,Critically assess and compare philosophical views on issues arising from elementary logic.
