score,s1,s2
0.8541,"An introductory course in formal logic, dealing with propositional and predicate logic.","This course covers a range of concepts, techniques and technologies in network security."
0.8854,Techniques of formal deduction and tests for the validity of arguments will be studied.,"The course features hands-on lectures and labs to analyse network vulnerabilities, and design and implement appropriate defensive techniques."
0.8895,Basic semantic concepts will be discussed.,Explain network security issues.
0.8724,Express reasoning problems using first order logical notation.,Explain network security issues.
0.8709,Construct natural deduction proofs in first order logic and translate between calculi.,"The course features hands-on lectures and labs to analyse network vulnerabilities, and design and implement appropriate defensive techniques."
0.8635,Explain the relationship between rules of deduction and the semantics of logic.,"This course covers a range of concepts, techniques and technologies in network security."
0.8929,Critically assess and compare philosophical views on issues arising from elementary logic.,"The course features hands-on lectures and labs to analyse network vulnerabilities, and design and implement appropriate defensive techniques."
