score,s1,s2
0.8847,Artificial intelligence is the science that studies and develops methods of making computers more /intelligent/.,Commerce and research are being transformed by data-driven discovery and prediction.
0.9554,"The focus of this course is on core AI techniques for search, knowledge representation and reasoning, planning, and designing intelligent agents.","Demonstrate basic knowledge and understanding of descriptive and predictive data analysis methods, optimization and search, and knowledge representation."
0.9064,"The course also aims to give an overview of the historical, philosophical, and logical foundations of AI.","Demonstrate basic knowledge and understanding of descriptive and predictive data analysis methods, optimization and search, and knowledge representation."
0.9269,"Identify problems that are amenable to solution by AI methods, and which AI methods may be suited to solving a given problem.",Apply their knowledge to a given problem domain and articulate potential data analysis problems.
0.9231,"Formalise a given problem in the language/framework of different AI methods (e.g., as a search problem, as a constraint satisfaction problem, as a planning problem, etc).","Tour the basic techniques of data science, including both SQL and NoSQL solutions for massive data management, basic statistical modeling (e.g., descriptive statistics, linear and non-linear regression), algorithms for machine learning and optimization, and fundamentals of knowledge representation and search."
0.9310,"Implement basic AI algorithms (e.g., standard search or constraint propagation algorithms).","Tour the basic techniques of data science, including both SQL and NoSQL solutions for massive data management, basic statistical modeling (e.g., descriptive statistics, linear and non-linear regression), algorithms for machine learning and optimization, and fundamentals of knowledge representation and search."
0.9433,"Design and perform an empirical evaluation of different algorithms on a problem formalisation, and state the conclusions that the evaluation supports.",Apply their knowledge to a given problem domain and articulate potential data analysis problems.
