score,s1,s2
0.9041,Information theory studies the fundamental limits of the representation and transmission of information.,Define and analyse time and space complexities of algorithms.
0.9159,"This course provides an introduction to information theory, studying fundamental concepts such as probability, information, and entropy and examining their applications in the areas of data compression, coding, communications, pattern recognition and probabilistic inference.","It will cover various data structures and algorithm design techniques for solving these two classes of problems, as well as basic performance measures and analysis techniques for solving such problems."
0.9342,"Understand and apply fundamental concepts in information theory such as probability, entropy, information content and their inter-relationships.","Display an advanced understanding of a variety of algorithms, including linear selection, minimum spanning trees, single source shortest path, Huffman coding, etc, with real-life applications and the resource requirements."
0.8957,Understand the principles of data compression.,This course provides basic approaches for designing and analysing algorithms and data structures.
0.8965,Compute entropy and mutual information of random variables.,Define and analyse time and space complexities of algorithms.
0.9429,Implement and analyse basic coding and compression algorithms.,This course provides basic approaches for designing and analysing algorithms and data structures.
0.9332,Understand the relationship of information theoretical principles and Bayesian inference in data modelling and pattern recognition.,"Display an advanced understanding of a variety of algorithms, including linear selection, minimum spanning trees, single source shortest path, Huffman coding, etc, with real-life applications and the resource requirements."
0.9295,"Understand some key theorems and inequalities that quantify essential limitations on compression, communication and inference.","Display an advanced understanding of a variety of algorithms, including linear selection, minimum spanning trees, single source shortest path, Huffman coding, etc, with real-life applications and the resource requirements."
0.9033,Know the basic concepts regarding communications over noisy channels.,"Display an advanced understanding of a variety of algorithms, including linear selection, minimum spanning trees, single source shortest path, Huffman coding, etc, with real-life applications and the resource requirements."
