score,s1,s2
0.8995,"Software Security covers advanced techniques in software vulnerability assessment, discovery and mitigation.","The focus of this course is on core AI techniques for search, knowledge representation and reasoning, planning, and designing intelligent agents."
0.8940,"These include: common patterns in software vulnerabilities, such as stack-based buffer overflow, format string vulnerabilities, and heap-based vulnerabilities; exploitation techniques such as code injection, return-oriented-programming; techniques for vulnerability discovery, such as program binaries reverse engineering, fuzzing and symbolic execution; and mitigation techniques such as memory protection mechanisms, input sanitation, and control flow integrity protection.","Implement basic AI algorithms (e.g., standard search or constraint propagation algorithms)."
0.9198,"The course features hands-on lectures and labs to analyse software vulnerabilities, both in the source code and in program binaries, and design and implement appropriate mitigation techniques.","The focus of this course is on core AI techniques for search, knowledge representation and reasoning, planning, and designing intelligent agents."
0.8869,Demonstrate a thorough understanding of common sources of vulnerabilities in software.,"The focus of this course is on core AI techniques for search, knowledge representation and reasoning, planning, and designing intelligent agents."
0.9114,Demonstrate a thorough understanding in exploitation techniques against software vulnerabilities and defensive techniques against these exploitations.,"Design and perform an empirical evaluation of different algorithms on a problem formalisation, and state the conclusions that the evaluation supports."
0.9050,Demonstrate proficiency in software reverse engineering.,"The focus of this course is on core AI techniques for search, knowledge representation and reasoning, planning, and designing intelligent agents."
0.9115,"Demonstrate proficiency in vulnerability discovery processes, from both source code and binary.","The focus of this course is on core AI techniques for search, knowledge representation and reasoning, planning, and designing intelligent agents."
0.9254,"Apply the vulnerability discovery techniques to real-world software, analyse their vulnerabilities and design and implement appropriate mitigation techniques.","Design and perform an empirical evaluation of different algorithms on a problem formalisation, and state the conclusions that the evaluation supports."
