score,s1,s2
0.9229,"This course will provide an introduction to the field of Human-Computer Interaction and will introduce students to key interaction and experience design paradigms, approaches and methods.",This course is an introduction to relational databases and the general skills for designing and using them.
0.9159,"The course will equip students with theory, methods, and techniques to investigate different design situations, develop novel design ideas, and ask critical questions about the role of technology in society.","To deepen the understanding of relational databases, the current industry development of database systems such as NoSQL databases will be introduced at the end of this course."
0.8985,"Characterise key aspects of human-computer interaction, such as interaction design, the user experience, and user interfaces.","To deepen the understanding of relational databases, the current industry development of database systems such as NoSQL databases will be introduced at the end of this course."
0.9112,"Differentiate between design paradigms, approaches, and methods and explain their applicability to different design contexts.","To deepen the understanding of relational databases, the current industry development of database systems such as NoSQL databases will be introduced at the end of this course."
0.9148,"Investigate the activities and practices of a design space using design research methods, to identify opportunities and issues for design intervention.",Apply database design methods on functional dependencies and normal forms to evaluate the quality of a relational database design.
0.9003,"Ideate, prototype, and evaluate novel technology design ideas and their use in context.",Apply database design methods on functional dependencies and normal forms to evaluate the quality of a relational database design.
0.8771,"Critically reflect on the role of technology in society, including issues of power, agency, and representation in design.","To deepen the understanding of relational databases, the current industry development of database systems such as NoSQL databases will be introduced at the end of this course."
