score,s1,s2
0.9241,"This course studies the standard models for the layered approach to communication between autonomous machines in a network, and the main characteristics of data transmission across various physical link types.",Understand and report on the nature and practice of human computer interaction research in an ethical environment.
0.9347,"It considers how to design networks and protocols for diverse situations, analyses several application and support protocols from a distributed systems viewpoint, and identifies significant problem areas in networked communications.","Understand and be able to develop and design web sites including multimedia content by applying current web design principles, guidelines and heuristics."
0.9464,"Topics include: communication network architectures, signalling and modulation across physical media, real-world local and wide-area networks, internet protocol fundamentals, performance and monitoring of networks, routing, network security, and application protocols for distributed systems including web, email, video, internet-of-everything and other contemporary network topics.","Topics such as the nature and types of multimedia objects, components of a multimedia system, Web authoring, delivery tools, multimedia applications, spam, podcasts, RSS, web spam and societal implications of the web. Students will create multimedia applications using some or all of HTML, XHTML, JavaScript, animation, sound, video and 3D."
0.9132,Understand and describe the layered protocol model.,This course introduces the construction of web sites and web interface/interaction design.
0.9079,"Describe, analyse and compare a number of datalink, network, and transport layer protocols.","Topics such as the nature and types of multimedia objects, components of a multimedia system, Web authoring, delivery tools, multimedia applications, spam, podcasts, RSS, web spam and societal implications of the web. Students will create multimedia applications using some or all of HTML, XHTML, JavaScript, animation, sound, video and 3D."
0.9197,Program network communication services for client/server and other application layouts.,"Topics such as the nature and types of multimedia objects, components of a multimedia system, Web authoring, delivery tools, multimedia applications, spam, podcasts, RSS, web spam and societal implications of the web. Students will create multimedia applications using some or all of HTML, XHTML, JavaScript, animation, sound, video and 3D."
0.9464,"Describe and analyse various related technical, administrative and social aspects of specific computer network protocols from standards documents and other primary materials found through research.","Understand and be able to develop and design web sites including multimedia content by applying current web design principles, guidelines and heuristics."
0.9113,"Design and/or analyse networks and services for homes, data centres, IoT/IoE, LANs and WANs.","Topics such as the nature and types of multimedia objects, components of a multimedia system, Web authoring, delivery tools, multimedia applications, spam, podcasts, RSS, web spam and societal implications of the web. Students will create multimedia applications using some or all of HTML, XHTML, JavaScript, animation, sound, video and 3D."
