score,s1,s2
0.8816,Computer graphics are an essential part of modern software.,Demonstrate proficiency in software reverse engineering.
0.9220,"In this course students will learn about fundamental algorithms, data structures and programming models used in 3D graphics applications.","The course features hands-on lectures and labs to analyse software vulnerabilities, both in the source code and in program binaries, and design and implement appropriate mitigation techniques."
0.9110,"These key concepts in computer graphics programming will be covered from their mathematical foundations through to their application in domains such as data visualisation, virtual reality, computer games and film animation/VFX.","The course features hands-on lectures and labs to analyse software vulnerabilities, both in the source code and in program binaries, and design and implement appropriate mitigation techniques."
0.9219,In this course students will explore these concepts through practical implementation in a modern computer graphics software context.,"The course features hands-on lectures and labs to analyse software vulnerabilities, both in the source code and in program binaries, and design and implement appropriate mitigation techniques."
0.9006,"Explain the stages of a modern, hardware-accelerated 3D rendering pipeline","Demonstrate proficiency in vulnerability discovery processes, from both source code and binary."
0.8995,"Construct and manipulate complex models, geometries and scene graphs in both 2D and 3D","Demonstrate proficiency in vulnerability discovery processes, from both source code and binary."
0.9012,Implement computer graphics algorithms in a shader language,"Demonstrate proficiency in vulnerability discovery processes, from both source code and binary."
